{
  "$schema": "https://json-schema.org/draft/2020-12/schema",
  "$id": "https://conjure.dev/schemas/marketplace.schema.json",
  "title": "Claude Code marketplace.json",
  "description": "Validates .claude-plugin/marketplace.json (Conjure-emitted target-repo marketplace).",
  "type": "object",
  "required": ["name", "owner", "plugins"],
  "properties": {
    "name":        { "type": "string", "pattern": "^[a-z][a-z0-9-]{0,63}$" },
    "description": { "type": "string" },
    "owner": {
      "type": "object",
      "required": ["name"],
      "properties": {
        "name":  { "type": "string" },
        "email": { "type": "string" }
      }
    },
    "plugins": {
      "type": "array",
      "items": {
        "type": "object",
        "required": ["name", "source"],
        "properties": {
          "name":        { "type": "string" },
          "description": { "type": "string" },
          "version":     { "type": "string" },
          "source":      { "type": "object" },
          "author":      { "type": ["object", "string"] },
          "homepage":    { "type": "string" },
          "repository":  { "type": ["object", "string"] },
          "license":     { "type": "string" },
          "keywords":    { "type": "array", "items": { "type": "string" } },
          "category":    { "type": "string" }
        }
      }
    }
  }
}
