{
  "name": "conjure",
  "description": "Marketplace for the Conjure Claude Code harness kit.",
  "owner": {
    "name": "mohandoz",
    "email": "33397039+mohandoz@users.noreply.github.com"
  },
  "plugins": [
    {
      "name": "conjure",
      "description": "Production-grade init kit for Claude Code. Lazy-loaded skills, deterministic hooks, isolated subagents, knowledge graph, stack profiles, compliance overlays, safe migration.",
      "version": "0.5.0",
      "source": {
        "source": "github",
        "repo": "mohandoz/conjure",
        "ref": "main",
        "sha": "d07c59bbda32e02f2dcf2ded70d34b78f1e4b820"
      },
      "author": {
        "name": "mohandoz",
        "email": "33397039+mohandoz@users.noreply.github.com"
      },
      "homepage": "https://github.com/mohandoz/conjure",
      "repository": "https://github.com/mohandoz/conjure",
      "license": "MIT",
      "keywords": ["scaffold", "harness", "skills", "hooks", "subagents", "knowledge-graph", "migration"],
      "category": "developer-tools"
    }
  ]
}
